{
  "schema_version": "1.0.0",
  "record_type": "project-instructions",
  "record_kind": "example",
  "project_name": "Example project",
  "repository_url": "https://github.com/kamil-kazmierczak/java-learning",
  "branch": "develop",
  "entry_file": "AGENTS.md",
  "required_checks": [
    "validate-data"
  ],
  "bootstrap_steps": [
    "Read the required checks for one commit.",
    "Read AGENTS.md from that same commit.",
    "Do not use example records as learner evidence."
  ],
  "failure_steps": [
    "Report a failed or unknown check.",
    "Use the last approved passing ancestor for all lesson reads."
  ]
}
